{
 "layout_seed": "1038056430426598533",
 "links": [
  {
   "a": "burn_the_ledger",
   "b": "t2_e",
   "pts": [
    [
     -298.6004,
     91.5343
    ],
    [
     -337.1781,
     84.8137
    ]
   ],
   "state": "open"
  },
  {
   "a": "home",
   "b": "t1_a",
   "pts": [
    [
     -449.2405,
     35.6668
    ],
    [
     -440.6569,
     133.9365
    ]
   ],
   "state": "open"
  },
  {
   "a": "home",
   "b": "t1_b",
   "pts": [
    [
     -449.2405,
     35.6668
    ],
    [
     -431.7675,
     118.5397
    ]
   ],
   "state": "open"
  },
  {
   "a": "home",
   "b": "t1_c",
   "pts": [
    [
     -449.2405,
     35.6668
    ],
    [
     -422.8782,
     103.1429
    ]
   ],
   "state": "open"
  },
  {
   "a": "home",
   "b": "t1_d",
   "pts": [
    [
     -449.2405,
     35.6668
    ],
    [
     -413.9888,
     87.7461
    ]
   ],
   "state": "open"
  },
  {
   "a": "home",
   "b": "t1_e",
   "pts": [
    [
     -449.2405,
     35.6668
    ],
    [
     -405.0995,
     72.3493
    ]
   ],
   "state": "open"
  },
  {
   "a": "home",
   "b": "t1_f",
   "pts": [
    [
     -449.2405,
     35.6668
    ],
    [
     -396.2102,
     56.9525
    ]
   ],
   "state": "open"
  },
  {
   "a": "home",
   "b": "t1_g",
   "pts": [
    [
     -449.2405,
     35.6668
    ],
    [
     -387.3208,
     41.5557
    ]
   ],
   "state": "open"
  },
  {
   "a": "home",
   "b": "t1_h",
   "pts": [
    [
     -449.2405,
     35.6668
    ],
    [
     -378.4315,
     26.1589
    ]
   ],
   "state": "open"
  },
  {
   "a": "home",
   "b": "t1_i",
   "pts": [
    [
     -449.2405,
     35.6668
    ],
    [
     -369.5421,
     10.7621
    ]
   ],
   "state": "open"
  },
  {
   "a": "home",
   "b": "t1_j",
   "pts": [
    [
     -449.2405,
     35.6668
    ],
    [
     -360.6528,
     -4.6346
    ]
   ],
   "state": "open"
  },
  {
   "a": "purge_camera_logs",
   "b": "t1_i",
   "pts": [
    [
     -340.1231,
     33.346
    ],
    [
     -369.5421,
     10.7621
    ]
   ],
   "state": "open"
  },
  {
   "a": "scrub_records",
   "b": "t1_a",
   "pts": [
    [
     -410.1604,
     154.6541
    ],
    [
     -440.6569,
     133.9365
    ]
   ],
   "state": "open"
  },
  {
   "a": "t1_a",
   "b": "t1_b",
   "pts": [
    [
     -440.6569,
     133.9365
    ],
    [
     -431.7675,
     118.5397
    ]
   ],
   "state": "locked"
  },
  {
   "a": "t1_a",
   "b": "t2_intel",
   "pts": [
    [
     -440.6569,
     133.9365
    ],
    [
     -380.278,
     159.4649
    ]
   ],
   "state": "open"
  },
  {
   "a": "t1_b",
   "b": "t1_c",
   "pts": [
    [
     -431.7675,
     118.5397
    ],
    [
     -422.8782,
     103.1429
    ]
   ],
   "state": "locked"
  },
  {
   "a": "t1_b",
   "b": "t2_breach",
   "pts": [
    [
     -431.7675,
     118.5397
    ],
    [
     -369.503,
     140.8021
    ]
   ],
   "state": "open"
  },
  {
   "a": "t1_c",
   "b": "t2_virus",
   "pts": [
    [
     -422.8782,
     103.1429
    ],
    [
     -358.7281,
     122.1393
    ]
   ],
   "state": "open"
  },
  {
   "a": "t1_d",
   "b": "t1_e",
   "pts": [
    [
     -413.9888,
     87.7461
    ],
    [
     -405.0995,
     72.3493
    ]
   ],
   "state": "locked"
  },
  {
   "a": "t1_d",
   "b": "t2_d",
   "pts": [
    [
     -413.9888,
     87.7461
    ],
    [
     -347.9531,
     103.4765
    ]
   ],
   "state": "open"
  },
  {
   "a": "t1_e",
   "b": "t2_e",
   "pts": [
    [
     -405.0995,
     72.3493
    ],
    [
     -337.1781,
     84.8137
    ]
   ],
   "state": "open"
  },
  {
   "a": "t1_f",
   "b": "t1_g",
   "pts": [
    [
     -396.2102,
     56.9525
    ],
    [
     -387.3208,
     41.5557
    ]
   ],
   "state": "locked"
  },
  {
   "a": "t1_f",
   "b": "t2_f",
   "pts": [
    [
     -396.2102,
     56.9525
    ],
    [
     -326.4032,
     66.151
    ]
   ],
   "state": "open"
  },
  {
   "a": "t1_g",
   "b": "t2_g",
   "pts": [
    [
     -387.3208,
     41.5557
    ],
    [
     -315.6282,
     47.4882
    ]
   ],
   "state": "open"
  },
  {
   "a": "t1_h",
   "b": "t1_i",
   "pts": [
    [
     -378.4315,
     26.1589
    ],
    [
     -369.5421,
     10.7621
    ]
   ],
   "state": "locked"
  },
  {
   "a": "t1_h",
   "b": "t2_h",
   "pts": [
    [
     -378.4315,
     26.1589
    ],
    [
     -304.8533,
     28.8254
    ]
   ],
   "state": "open"
  },
  {
   "a": "t1_j",
   "b": "wipe_biometrics",
   "pts": [
    [
     -360.6528,
     -4.6346
    ],
    [
     -322.8581,
     9.0989
    ]
   ],
   "state": "open"
  },
  {
   "a": "t2_breach",
   "b": "t2_intel",
   "pts": [
    [
     -369.503,
     140.8021
    ],
    [
     -380.278,
     159.4649
    ]
   ],
   "state": "locked"
  },
  {
   "a": "t2_breach",
   "b": "t3_b",
   "pts": [
    [
     -369.503,
     140.8021
    ],
    [
     -313.1648,
     173.329
    ]
   ],
   "state": "open"
  },
  {
   "a": "t2_d",
   "b": "t2_virus",
   "pts": [
    [
     -347.9531,
     103.4765
    ],
    [
     -358.7281,
     122.1393
    ]
   ],
   "state": "locked"
  },
  {
   "a": "t2_d",
   "b": "t3_d",
   "pts": [
    [
     -347.9531,
     103.4765
    ],
    [
     -291.6148,
     136.0034
    ]
   ],
   "state": "open"
  },
  {
   "a": "t2_e",
   "b": "t3_e",
   "pts": [
    [
     -337.1781,
     84.8137
    ],
    [
     -280.8399,
     117.3407
    ]
   ],
   "state": "open"
  },
  {
   "a": "t2_f",
   "b": "t2_g",
   "pts": [
    [
     -326.4032,
     66.151
    ],
    [
     -315.6282,
     47.4882
    ]
   ],
   "state": "locked"
  },
  {
   "a": "t2_f",
   "b": "t3_f",
   "pts": [
    [
     -326.4032,
     66.151
    ],
    [
     -270.0649,
     98.6779
    ]
   ],
   "state": "open"
  },
  {
   "a": "t2_g",
   "b": "t3_g",
   "pts": [
    [
     -315.6282,
     47.4882
    ],
    [
     -259.29,
     80.0151
    ]
   ],
   "state": "open"
  },
  {
   "a": "t2_h",
   "b": "t3_h",
   "pts": [
    [
     -304.8533,
     28.8254
    ],
    [
     -248.515,
     61.3523
    ]
   ],
   "state": "open"
  },
  {
   "a": "t2_intel",
   "b": "t3_core",
   "pts": [
    [
     -380.278,
     159.4649
    ],
    [
     -323.9397,
     191.9918
    ]
   ],
   "state": "open"
  },
  {
   "a": "t2_virus",
   "b": "t3_c",
   "pts": [
    [
     -358.7281,
     122.1393
    ],
    [
     -302.3898,
     154.6662
    ]
   ],
   "state": "open"
  },
  {
   "a": "t3_b",
   "b": "t3_core",
   "pts": [
    [
     -313.1648,
     173.329
    ],
    [
     -323.9397,
     191.9918
    ]
   ],
   "state": "locked"
  },
  {
   "a": "t3_b",
   "b": "the_genome_core",
   "pts": [
    [
     -313.1648,
     173.329
    ],
    [
     -228.7865,
     162.946
    ]
   ],
   "state": "open"
  },
  {
   "a": "t3_core",
   "b": "the_genome_core",
   "pts": [
    [
     -323.9397,
     191.9918
    ],
    [
     -228.7865,
     162.946
    ]
   ],
   "state": "open"
  },
  {
   "a": "t3_c",
   "b": "the_genome_core",
   "pts": [
    [
     -302.3898,
     154.6662
    ],
    [
     -228.7865,
     162.946
    ]
   ],
   "state": "open"
  },
  {
   "a": "t3_d",
   "b": "t3_e",
   "pts": [
    [
     -291.6148,
     136.0034
    ],
    [
     -280.8399,
     117.3407
    ]
   ],
   "state": "locked"
  },
  {
   "a": "t3_d",
   "b": "the_genome_core",
   "pts": [
    [
     -291.6148,
     136.0034
    ],
    [
     -228.7865,
     162.946
    ]
   ],
   "state": "open"
  },
  {
   "a": "t3_e",
   "b": "the_genome_core",
   "pts": [
    [
     -280.8399,
     117.3407
    ],
    [
     -228.7865,
     162.946
    ]
   ],
   "state": "open"
  },
  {
   "a": "t3_f",
   "b": "the_genome_core",
   "pts": [
    [
     -270.0649,
     98.6779
    ],
    [
     -228.7865,
     162.946
    ]
   ],
   "state": "open"
  },
  {
   "a": "t3_g",
   "b": "t3_h",
   "pts": [
    [
     -259.29,
     80.0151
    ],
    [
     -248.515,
     61.3523
    ]
   ],
   "state": "locked"
  },
  {
   "a": "t3_g",
   "b": "the_genome_core",
   "pts": [
    [
     -259.29,
     80.0151
    ],
    [
     -228.7865,
     162.946
    ]
   ],
   "state": "open"
  },
  {
   "a": "t3_h",
   "b": "the_genome_core",
   "pts": [
    [
     -248.515,
     61.3523
    ],
    [
     -228.7865,
     162.946
    ]
   ],
   "state": "open"
  }
 ],
 "nodes": [
  {
   "id": "burn_the_ledger",
   "lot": [
    -298.6004,
    91.5343
   ],
   "state": "corporate"
  },
  {
   "id": "home",
   "lot": [
    -449.2405,
    35.6668
   ],
   "state": "core"
  },
  {
   "id": "purge_camera_logs",
   "lot": [
    -340.1231,
    33.346
   ],
   "state": "corporate"
  },
  {
   "id": "scrub_records",
   "lot": [
    -410.1604,
    154.6541
   ],
   "state": "corporate"
  },
  {
   "id": "t1_a",
   "lot": [
    -440.6569,
    133.9365
   ],
   "state": "corporate"
  },
  {
   "id": "t1_b",
   "lot": [
    -431.7675,
    118.5397
   ],
   "state": "corporate"
  },
  {
   "id": "t1_c",
   "lot": [
    -422.8782,
    103.1429
   ],
   "state": "corporate"
  },
  {
   "id": "t1_d",
   "lot": [
    -413.9888,
    87.7461
   ],
   "state": "corporate"
  },
  {
   "id": "t1_e",
   "lot": [
    -405.0995,
    72.3493
   ],
   "state": "corporate"
  },
  {
   "id": "t1_f",
   "lot": [
    -396.2102,
    56.9525
   ],
   "state": "corporate"
  },
  {
   "id": "t1_g",
   "lot": [
    -387.3208,
    41.5557
   ],
   "state": "corporate"
  },
  {
   "id": "t1_h",
   "lot": [
    -378.4315,
    26.1589
   ],
   "state": "corporate"
  },
  {
   "id": "t1_i",
   "lot": [
    -369.5421,
    10.7621
   ],
   "state": "corporate"
  },
  {
   "id": "t1_j",
   "lot": [
    -360.6528,
    -4.6346
   ],
   "state": "corporate"
  },
  {
   "id": "t2_breach",
   "lot": [
    -369.503,
    140.8021
   ],
   "state": "corporate"
  },
  {
   "id": "t2_d",
   "lot": [
    -347.9531,
    103.4765
   ],
   "state": "corporate"
  },
  {
   "id": "t2_e",
   "lot": [
    -337.1781,
    84.8137
   ],
   "state": "corporate"
  },
  {
   "id": "t2_f",
   "lot": [
    -326.4032,
    66.151
   ],
   "state": "corporate"
  },
  {
   "id": "t2_g",
   "lot": [
    -315.6282,
    47.4882
   ],